text,label,source,source_url,notes
"Update: 500K+ multimodal prompt injection samples","tool_or_control","r/LocalLLaMA - Multimodal prompt injection samples","https://www.reddit.com/r/LocalLLaMA/comments/1stjuw9/update_500k_multimodal_prompt_injection_samples/","Describes a large dataset/resource for multimodal prompt-injection detection."
"Reasoning model DoS is important for anyone running o1, R1, or QwQ.","concept_definition","r/LocalLLaMA - Multimodal prompt injection samples","https://www.reddit.com/r/LocalLLaMA/comments/1stjuw9/update_500k_multimodal_prompt_injection_samples/","Introduces reasoning-model denial of service as a risk concept."
"OverThink injects decoy MDP problems into RAG context that cause 46x slowdown.","attack_or_testing_tactic","r/LocalLLaMA - Multimodal prompt injection samples","https://www.reddit.com/r/LocalLLaMA/comments/1stjuw9/update_500k_multimodal_prompt_injection_samples/","Describes a RAG-context denial-of-service attack tactic."
"BadThink inflates reasoning traces while keeping answers correct.","attack_or_testing_tactic","r/LocalLLaMA - Multimodal prompt injection samples","https://www.reddit.com/r/LocalLLaMA/comments/1stjuw9/update_500k_multimodal_prompt_injection_samples/","Describes reasoning-trace inflation as an attack tactic."
"A simple triple-base64 encoding causes token amplification on R1.","attack_or_testing_tactic","r/LocalLLaMA - Multimodal prompt injection samples","https://www.reddit.com/r/LocalLLaMA/comments/1stjuw9/update_500k_multimodal_prompt_injection_samples/","Describes encoding-based token amplification against a reasoning model."
"These attacks do not jailbreak your model - they bankrupt you on compute.","concept_definition","r/LocalLLaMA - Multimodal prompt injection samples","https://www.reddit.com/r/LocalLLaMA/comments/1stjuw9/update_500k_multimodal_prompt_injection_samples/","Explains compute-exhaustion risk separate from jailbreak behavior."
"Lessons from deploying RAG bots for regulated industries","tool_or_control","r/LocalLLaMA - Lessons from deploying RAG bots","https://www.reddit.com/r/LocalLLaMA/comments/1s6oiuq/lessons_from_deploying_rag_bots_for_regulated/","Post title points to deployment controls for regulated RAG systems."
"Do not overengineer your RAG. Test with real users and your own handcrafted test set.","tool_or_control","r/LocalLLaMA - Lessons from deploying RAG bots","https://www.reddit.com/r/LocalLLaMA/comments/1s6oiuq/lessons_from_deploying_rag_bots_for_regulated/","Recommends user testing and handcrafted test sets as evaluation controls."
"Establish a feedback monitoring pipeline early on.","tool_or_control","r/LocalLLaMA - Lessons from deploying RAG bots","https://www.reddit.com/r/LocalLLaMA/comments/1s6oiuq/lessons_from_deploying_rag_bots_for_regulated/","Identifies feedback monitoring as a deployment control."
"Langfuse works well enough and is easy to integrate into a traditional stack.","tool_or_control","r/LocalLLaMA - Lessons from deploying RAG bots","https://www.reddit.com/r/LocalLLaMA/comments/1s6oiuq/lessons_from_deploying_rag_bots_for_regulated/","Names Langfuse as an observability/monitoring tool for LLM workflows."
"Does RAG work on large codebases? Or does chunking make it mostly useless?","low_signal_or_general","r/LocalLLaMA - RAG on large codebases","https://www.reddit.com/r/LocalLLaMA/comments/1gf2mg5/does_rag_work_on_large_codebases_or_does_chunking/","Broad question about RAG effectiveness rather than a specific security concept."
"I plan on putting developers' app codebases into individual Open WebUI knowledge repositories to keep them all separated.","tool_or_control","r/LocalLLaMA - RAG on large codebases","https://www.reddit.com/r/LocalLLaMA/comments/1gf2mg5/does_rag_work_on_large_codebases_or_does_chunking/","Describes repository separation as a data-isolation design choice."
"I plan on using RAG of specific codebases using tags.","tool_or_control","r/LocalLLaMA - RAG on large codebases","https://www.reddit.com/r/LocalLLaMA/comments/1gf2mg5/does_rag_work_on_large_codebases_or_does_chunking/","Describes scoped RAG retrieval using tags."
"Discussing the Adversarial ML Threat Matrix","concept_definition","r/MachineLearning - Adversarial ML Threat Matrix","https://www.reddit.com/r/MachineLearning/comments/jifw13/d_discussing_the_adversarial_ml_threat_matrix/","Post title identifies an adversarial ML framework."
"The ATT&CK format is accessible to security analysts who are not well versed in ML algorithms.","tool_or_control","r/MachineLearning - Adversarial ML Threat Matrix","https://www.reddit.com/r/MachineLearning/comments/jifw13/d_discussing_the_adversarial_ml_threat_matrix/","Explains ATT&CK-style structure as a usable framework/control reference."
"It provides guidelines on key places to look for compromise.","tool_or_control","r/MachineLearning - Adversarial ML Threat Matrix","https://www.reddit.com/r/MachineLearning/comments/jifw13/d_discussing_the_adversarial_ml_threat_matrix/","Describes guidance for compromise investigation."
"The matrix provides ML engineers with insights on how their practices can create attack vectors.","concept_definition","r/MachineLearning - Adversarial ML Threat Matrix","https://www.reddit.com/r/MachineLearning/comments/jifw13/d_discussing_the_adversarial_ml_threat_matrix/","Explains how ML development practices can create attack vectors."
"Black box adversarial attacks that do not require output labels","concept_definition","r/MachineLearning - Black box adversarial attacks","https://www.reddit.com/r/MachineLearning/comments/vi97e2/r_black_box_adversarial_attacks_that_do_not/","Post title introduces black-box adversarial attack concepts."
"Are there any black box attacks that do not require the model's output labels?","concept_definition","r/MachineLearning - Black box adversarial attacks","https://www.reddit.com/r/MachineLearning/comments/vi97e2/r_black_box_adversarial_attacks_that_do_not/","Asks about black-box attack assumptions and output-label access."
"What are adversarial examples in NLP?","concept_definition","r/MachineLearning - Adversarial examples in NLP","https://www.reddit.com/r/MachineLearning/comments/iibdeh/p_what_are_adversarial_examples_in_nlp/","Post title identifies adversarial examples in NLP as a concept."
"Adversarial perturbations cause an imperceptible change to humans but a total misclassification to computer vision models.","concept_definition","r/MachineLearning - Adversarial examples in NLP","https://www.reddit.com/r/MachineLearning/comments/iibdeh/p_what_are_adversarial_examples_in_nlp/","Defines adversarial perturbations and model misclassification."
"Is adversarial attack common in industry?","low_signal_or_general","r/MachineLearning - Is adversarial attack common in industry?","https://www.reddit.com/r/MachineLearning/comments/p9sy3b/d_r_is_adversarial_attack_common_in_industry/","Broad question about industry relevance without a specific tactic in the excerpt."
"Papers benchmark their methods against adversarial attacks like FGSM, PGD, OnePixel, etc.","tool_or_control","r/MachineLearning - Is adversarial attack common in industry?","https://www.reddit.com/r/MachineLearning/comments/p9sy3b/d_r_is_adversarial_attack_common_in_industry/","Names benchmark attack methods used to evaluate adversarial robustness."
"The results are interesting, but I wonder whether these methods actually happen in industry.","low_signal_or_general","r/MachineLearning - Is adversarial attack common in industry?","https://www.reddit.com/r/MachineLearning/comments/p9sy3b/d_r_is_adversarial_attack_common_in_industry/","Broad practical-relevance question without a concrete control or tactic."
"Have adversarial examples done any damage in the real world?","low_signal_or_general","r/MachineLearning - Have adversarial examples done damage?","https://www.reddit.com/r/MachineLearning/comments/kxu9oa/d_have_adversarial_examples_done_any_damage_in/","Broad question about real-world damage without enough technical detail in the excerpt."
"I watched an overview of adversarial examples covering realistic attacks that have been published so far.","concept_definition","r/MachineLearning - Have adversarial examples done damage?","https://www.reddit.com/r/MachineLearning/comments/kxu9oa/d_have_adversarial_examples_done_any_damage_in/","References realistic adversarial example attacks as a concept area."
"The security paradox of local LLMs","low_signal_or_general","r/netsec - The security paradox of local LLMs","https://www.reddit.com/r/netsec/comments/1od7azc/the_security_paradox_of_local_llms/","Title-level framing is relevant but broad."
"This depends on the attacker already being inside your organization to influence your local LLM.","concept_definition","r/netsec - The security paradox of local LLMs","https://www.reddit.com/r/netsec/comments/1od7azc/the_security_paradox_of_local_llms/","Explains an attacker-position assumption for local LLM risk."
"If an outside actor can inject information to your local LLM, what are you doing?","low_signal_or_general","r/netsec - The security paradox of local LLMs","https://www.reddit.com/r/netsec/comments/1od7azc/the_security_paradox_of_local_llms/","Rhetorical critique with limited technical specificity."
"Do you have a habit of giving randos access to your database as well?","low_signal_or_general","r/netsec - The security paradox of local LLMs","https://www.reddit.com/r/netsec/comments/1od7azc/the_security_paradox_of_local_llms/","Rhetorical low-signal analogy rather than a concrete technical control."
"AI-generated posts are not welcome.","low_signal_or_general","r/netsec - subreddit rules/sidebar","https://www.reddit.com/r/netsec/","Community rule/commentary, not a technical AI security concept."
"No tool posts are accepted unless they are quality technical posts explaining what is innovative about a tool.","low_signal_or_general","r/netsec - subreddit rules/sidebar","https://www.reddit.com/r/netsec/","Community moderation rule rather than AI security substance."