text,label,source,source_url,notes
"Language models (LLMs), such as those used in AI assistant, have a persistent structural vulnerability because LLMs do not distinguish between what are instructions and what is data.",concept_definition,r/cybersecurity - Are LLMs Fundamentally Vulnerable to Prompt Injection?,https://www.reddit.com/r/cybersecurity/comments/1plha98/are_llms_fundamentally_vulnerable_to_prompt/,Defines prompt injection as a structural issue where instructions and data are not clearly separated
"With LLMs, it gets complicated - data is instruction and instruction is data.",concept_definition,r/LocalLLaMA - Do you think prompt injection will ever get solved?,https://www.reddit.com/r/LocalLLaMA/comments/1i9214x/do_you_think_prompt_injection_will_ever_get/,Short concept explanation about why prompt injection is hard to solve
"The first layer is LLM firewalls. These sit between the application and the model, inspecting prompts before they are processed and responses before they are delivered.",tool_or_control,r/aisecurity - How to Prevent Prompt Injection in AI,https://www.reddit.com/r/aisecurity/comments/1s7kf5r/how_to_prevent_prompt_injection_in_ai_best/,Mentions LLM firewalls as a runtime security control
"OWASP ranks prompt injection #1 in their LLM Top 10, An indirect injection in a retrieved document can trigger tool calls, exfiltrate data, or escalate privileges.",attack_or_testing_tactic,r/cybersecurity - How is your org handling prompt injection now?,https://www.reddit.com/r/cybersecurity/comments/1sx66fe/how_is_your_org_handling_prompt_injection_now/,Describes indirect prompt injection leading to tool calls and data exfiltration
"Two years ago, I released ""promptmap"", the first tool that automatically tests prompt injection attacks in GPT applications.",tool_or_control,r/LocalLLaMA - I wrote an open source tool to test prompt injection attacks,https://www.reddit.com/r/LocalLLaMA/comments/1i7d3hi/i_wrote_an_open_source_tool_to_test_prompt/,Mentions promptmap as a tool for testing prompt injection attacks
"The standard advice for preventing prompt injection is ""sanitise your inputs,"" but that feels like a losing battle.",tool_or_control,r/cybersecurity - A more robust way to think about defending against Prompt Injection,https://www.reddit.com/r/cybersecurity/comments/1m0afun/a_more_robust_way_to_think_about_defending/,Discusses input sanitization as a defensive control and why it may be insufficient
A subtle vector for spamming/phishing where the user just sees images/audio but there's nastiness behind the scenes.,attack_or_testing_tactic,r/LocalLLaMA - Malicious prompt injection,https://www.reddit.com/r/LocalLLaMA/comments/15a02le/malicious_prompt_injection/,Describes a multimodal hidden-instruction attack vector
"LLMs are a security threat, plain and simple.",low_signal_or_general,r/netsec - Microsoft Copilot: From Prompt Injection to Exfiltration of Personal Information,https://www.reddit.com/r/netsec/comments/1f34sr9/microsoft_copilot_from_prompt_injection_to/,"Broad opinion statement without a concrete concept, tool, or tactic"
"Now that agents are getting access to real systems — customer databases, code execution, internal tools — the attack surface is fundamentally different from a chatbot that can only generate text.","concept_definition","r/cybersecurity - How is your org handling prompt injection now?","https://www.reddit.com/r/cybersecurity/comments/1sx66fe/how_is_your_org_handling_prompt_injection_now/","Explains why production LLM agents create a different security risk than simple chatbots."
"Are you treating LLM inputs as untrusted the same way you'd treat user input in a web app?","tool_or_control","r/cybersecurity - How is your org handling prompt injection now?","https://www.reddit.com/r/cybersecurity/comments/1sx66fe/how_is_your_org_handling_prompt_injection_now/","Frames untrusted-input handling as a security control for LLM systems."
"An indirect injection in a retrieved document can trigger tool calls, exfiltrate data, or pivot to other agents in a multi-agent setup.","attack_or_testing_tactic","r/cybersecurity - How is your org handling prompt injection now?","https://www.reddit.com/r/cybersecurity/comments/1sx66fe/how_is_your_org_handling_prompt_injection_now/","Describes indirect prompt injection causing tool calls, exfiltration, and agent pivoting."
"Hi, Prompt injection attacks are increasing daily. Are there any practical detection mechanisms available to identify them?","tool_or_control","r/cybersecurity - Prompt Injection Detection?","https://www.reddit.com/r/cybersecurity/comments/1semk5r/prompt_injection_detection/","Asks about practical detection mechanisms for prompt injection."
"I've seen a lot of research focused on using additional LLM models as preventative guardrails, but practically nothing on detective controls - especially log-based ones.","tool_or_control","r/cybersecurity - Prompt Injection Detection?","https://www.reddit.com/r/cybersecurity/comments/1semk5r/prompt_injection_detection/","Mentions preventative guardrails and log-based detective controls."
"What a foolish buzzword. These prompt injections are essentially free-form and based on mathematical probabilities, so there's no way to detect or filter them.","low_signal_or_general","r/cybersecurity - Prompt injection is becoming a major security threat","https://www.reddit.com/r/cybersecurity/comments/1nhijzp/prompt_injection_is_becoming_a_major_security/","Opinionated and broad; related to AI security but not a concrete technical lesson."
"With the reality of prompt injection, the best assumption is that all LLM output is 'maximally evil' - that it is actively trying to exploit anything and everything downstream of it.","concept_definition","r/cybersecurity - Prompt injection is becoming a major security threat","https://www.reddit.com/r/cybersecurity/comments/1nhijzp/prompt_injection_is_becoming_a_major_security/","Explains a defensive mindset for treating LLM output as hostile."
"Feed it with system prompts of your LLM application and let it perform automated prompt injection attacks.","tool_or_control","r/LocalLLaMA - I wrote an open source tool to test prompt injection attacks","https://www.reddit.com/r/LocalLLaMA/comments/1i7d3hi/i_wrote_an_open_source_tool_to_test_prompt/","Describes using a tool to automate prompt-injection testing."
"It will reveal potential vulnerabilities and determine if attackers could extract your system prompts.","attack_or_testing_tactic","r/LocalLLaMA - I wrote an open source tool to test prompt injection attacks","https://www.reddit.com/r/LocalLLaMA/comments/1i7d3hi/i_wrote_an_open_source_tool_to_test_prompt/","Describes testing for system-prompt extraction."
"I spent a lot of time building a prompt injection scanner and learned a lot about what actually bypasses filters in production.","tool_or_control","r/cybersecurity - Breaking down the prompt injection attacks most AI apps aren't catching","https://www.reddit.com/r/cybersecurity/comments/1r3sjxz/breaking_down_the_prompt_injection_attacks_most/","Mentions a prompt-injection scanner and production filter bypass testing."
"Wrote up the techniques I found most interesting Base64 encoding, Cyrillic homoglyphs, multilingual injection, and semantic attacks that contain zero injection keywords.","attack_or_testing_tactic","r/cybersecurity - Breaking down the prompt injection attacks most AI apps aren't catching","https://www.reddit.com/r/cybersecurity/comments/1r3sjxz/breaking_down_the_prompt_injection_attacks_most/","Lists concrete prompt-injection bypass techniques."
"The core principle is to treat all user input as hostile and tainted by default.","tool_or_control","r/cybersecurity - A more robust way to think about defending against Prompt Injection","https://www.reddit.com/r/cybersecurity/comments/1m0afun/a_more_robust_way_to_think_about_defending/","Describes input tainting as a defensive control."
"Attackers are always finding creative ways to bypass blocklists with synonyms, weird encodings, or by hiding instructions in plain sight.","attack_or_testing_tactic","r/cybersecurity - A more robust way to think about defending against Prompt Injection","https://www.reddit.com/r/cybersecurity/comments/1m0afun/a_more_robust_way_to_think_about_defending/","Describes blocklist bypass tactics."
"When you give those clients access to your filesystem, databases, or APIs through MCP servers, you're opening up serious attack vectors.","concept_definition","r/LocalLLaMA - ContextGuard open-source security monitoring for MCP servers","https://www.reddit.com/r/LocalLLaMA/comments/1odyntn/contextguard_opensource_security_monitoring_for/","Explains the security risk created by MCP access to files, databases, and APIs."
"Prompt injection, data leakage, and path traversal attacks are all possible.","attack_or_testing_tactic","r/LocalLLaMA - ContextGuard open-source security monitoring for MCP servers","https://www.reddit.com/r/LocalLLaMA/comments/1odyntn/contextguard_opensource_security_monitoring_for/","Lists attack types possible through MCP-connected systems."
"Most developers building MCP servers don't have security expertise, and there wasn't an easy way to add protection.","low_signal_or_general","r/LocalLLaMA - ContextGuard open-source security monitoring for MCP servers","https://www.reddit.com/r/LocalLLaMA/comments/1odyntn/contextguard_opensource_security_monitoring_for/","Broad commentary about developer security gaps; useful context but not a concrete tactic."
"Prompt injection stopped being a chatbot trick this year. Here are the five patterns that changed the threat landscape, with real CVEs and incidents behind each one.","low_signal_or_general","r/cybersecurity - Prompt Injection in 2026: The Five Attack Patterns That Actually Matter","https://www.reddit.com/r/cybersecurity/comments/1t2ycd9/prompt_injection_in_2026_the_five_attack_patterns/","High-level framing of prompt injection trends without enough specific detail in this excerpt."
"Wraps your MCP server as a transparent security proxy.","tool_or_control","r/LocalLLaMA - ContextGuard open-source security monitoring for MCP servers","https://www.reddit.com/r/LocalLLaMA/comments/1odyntn/contextguard_opensource_security_monitoring_for/","Describes a security proxy control for MCP servers."
"Detects 8+ prompt injection patterns in real-time.","tool_or_control","r/LocalLLaMA - ContextGuard open-source security monitoring for MCP servers","https://www.reddit.com/r/LocalLLaMA/comments/1odyntn/contextguard_opensource_security_monitoring_for/","Describes real-time prompt-injection detection as a control."
"For data poisoning you may study and improve the transfer ability of attacks.","concept_definition","r/MachineLearning - Adversarial Machine Learning","https://www.reddit.com/r/MachineLearning/comments/1s36bxr/r_adversarial_machine_learning/","Introduces data poisoning and transferability as adversarial ML concepts."
"That means suppose to be in a black box scenario, you don't know the Dataset used for training phase, the model, the feature space and parameters with loss.","concept_definition","r/MachineLearning - Adversarial Machine Learning","https://www.reddit.com/r/MachineLearning/comments/1s36bxr/r_adversarial_machine_learning/","Explains a black-box adversarial ML scenario."
"However you are able to receive feedback from the target model, for example put a prompt in a Llm and obtaining response.","attack_or_testing_tactic","r/MachineLearning - Adversarial Machine Learning","https://www.reddit.com/r/MachineLearning/comments/1s36bxr/r_adversarial_machine_learning/","Describes probing a target model by sending prompts and observing feedback."
"Adversarial Attacks are a serious threat to DL models.","concept_definition","r/MachineLearning - Have you ever faced attacks on deep learning model in your projects?","https://www.reddit.com/r/MachineLearning/comments/n5f9u5/d_have_you_ever_faced_attacks_on_deep_learning/","Defines adversarial attacks as a threat to deep learning models."
"An attacker can intentionally create malicious inputs to fool the DL model and get the incorrect outputs.","attack_or_testing_tactic","r/MachineLearning - Have you ever faced attacks on deep learning model in your projects?","https://www.reddit.com/r/MachineLearning/comments/n5f9u5/d_have_you_ever_faced_attacks_on_deep_learning/","Describes malicious inputs used to fool a model."
"If we use an ""LLM security checker"" to prevent prompt injection attacks in our LLMs, what do we use to prevent prompt injection attacks in the ""LLM security checker""?","tool_or_control","r/netsec - Preventing Prompt Injection Attacks at Scale","https://www.reddit.com/r/netsec/comments/1l79xay/preventing_prompt_injection_attacks_at_scale/","Raises a control-design issue about securing the security checker itself."
"With the proliferation of MCP servers, your injection prompt may come with a JIRA ticket, a GitHub hidden image file, or open-source documentation.","attack_or_testing_tactic","r/netsec - The security paradox of local LLMs","https://www.reddit.com/r/netsec/comments/1od7azc/the_security_paradox_of_local_llms/","Describes realistic prompt-injection delivery paths through connected tools and documents."
"You either constrain LLM powers or risk that exposure.","tool_or_control","r/netsec - The security paradox of local LLMs","https://www.reddit.com/r/netsec/comments/1od7azc/the_security_paradox_of_local_llms/","Frames limiting model authority as a security control."
"Most prompt injection discussion focuses on text - jailbreaks, DAN prompts, that kind of thing.","concept_definition","r/cybersecurity - I've been testing how to inject prompts into images and audio files","https://www.reddit.com/r/cybersecurity/comments/1sd5ycz/ive_been_testing_how_to_inject_prompts_into/","Distinguishes text-based prompt injection from multimodal prompt injection."
"I've been looking at what happens when you hide instructions in places humans don't check: image metadata and ultrasonic audio.","attack_or_testing_tactic","r/cybersecurity - I've been testing how to inject prompts into images and audio files","https://www.reddit.com/r/cybersecurity/comments/1sd5ycz/ive_been_testing_how_to_inject_prompts_into/","Describes hiding instructions in image metadata and ultrasonic audio."
"I've been working on a systems-level analysis of why prompt injection, tool misuse, and agent failures keep recurring even as prompts and guardrails improve.","concept_definition","r/cybersecurity - Prompt injection isn't a prompting problem. It's an authority problem.","https://www.reddit.com/r/cybersecurity/comments/1pwvpo7/prompt_injection_isnt_a_prompting_problem_its_an/","Explains recurring prompt injection as a systems-level issue."
"Prompt injection isn’t a prompting problem. It’s an authority problem.","concept_definition","r/cybersecurity - Prompt injection isn't a prompting problem. It's an authority problem.","https://www.reddit.com/r/cybersecurity/comments/1pwvpo7/prompt_injection_isnt_a_prompting_problem_its_an/","Defines prompt injection as an authority/control problem rather than only a prompt-writing problem."
"If you're looking beyond simple jailbreaking, you should definitely check out Garak, an LLM vulnerability scanner, and PyRIT, Python Risk Identification Tool, by Microsoft.","tool_or_control","r/cybersecurity - Red teaming for AI/LLM apps","https://www.reddit.com/r/cybersecurity/comments/1r4p4du/red_teaming_for_aillm_apps/","Names Garak and PyRIT as LLM red-teaming tools."
"Both tools provide a more structured way to test for bias, toxicity, and data exfiltration rather than just basic prompt injections.","tool_or_control","r/cybersecurity - Red teaming for AI/LLM apps","https://www.reddit.com/r/cybersecurity/comments/1r4p4du/red_teaming_for_aillm_apps/","Explains structured AI/LLM testing beyond basic prompt injection."
"Promptfoo is great for running test cases and evaluating outputs at scale.","tool_or_control","r/cybersecurity - Red teaming for AI/LLM apps","https://www.reddit.com/r/cybersecurity/comments/1r4p4du/red_teaming_for_aillm_apps/","Names Promptfoo as an evaluation/testing tool."
"Neglected scalability and security, for example prompt injection, to a degree because it's only being used by a few trusted people.","low_signal_or_general","r/LocalLLaMA - Architecture and middleware for RAG assistants","https://www.reddit.com/r/LocalLLaMA/comments/1iec75g/architecture_and_middleware_for_rag_assistants/","General comment about underprioritizing RAG security; useful context but not a detailed tactic."
"While I'm usually wary of opinionated frameworks, I find standardization can be a good thing that helps you focus on your business value.","low_signal_or_general","r/LocalLLaMA - Architecture and middleware for RAG assistants","https://www.reddit.com/r/LocalLLaMA/comments/1iec75g/architecture_and_middleware_for_rag_assistants/","General opinion about frameworks and standardization rather than a concrete AI security concept."
"What all tools or things you are doing in AI security and in AI for Cloud Security, where do you get learning’s as well, anything new in this area?","low_signal_or_general","r/cybersecurity - What are you doing in AI Security?","https://www.reddit.com/r/cybersecurity/comments/1plg8m0/what_are_you_doing_in_ai_security/","Broad question about AI security learning and tools; not itself a technical concept or tactic."
"The funfact is that the ai stuff will bring more vulns in products.","low_signal_or_general","r/cybersecurity - What are you doing in AI Security?","https://www.reddit.com/r/cybersecurity/comments/1plg8m0/what_are_you_doing_in_ai_security/","Broad opinion that AI will introduce more vulnerabilities without specific technical detail."
"I've written a blog post to showcase the different experiments I've had with prompt injection attacks, their detection, and prevention.","low_signal_or_general","r/netsec - Preventing Prompt Injection Attacks at Scale","https://www.reddit.com/r/netsec/comments/1l79xay/preventing_prompt_injection_attacks_at_scale/","Promotional/high-level summary without enough specific technical content in the excerpt."
"Pretty much. You can't exploit something that offers insecurity as a feature.","low_signal_or_general","r/netsec - Microsoft Copilot: From Prompt Injection to Exfiltration of Personal Information","https://www.reddit.com/r/netsec/comments/1f34sr9/microsoft_copilot_from_prompt_injection_to/","Opinionated statement about LLM insecurity; low technical specificity."
"Rolling out Copilot: How worried should I be about Indirect Prompt Injection?","attack_or_testing_tactic","r/cybersecurity - Rolling out Copilot","https://www.reddit.com/r/cybersecurity/comments/1uaxq9e/rolling_out_copilot_how_worried_should_i_be_about/","Post title describes indirect prompt injection risk in Copilot-style document workflows."
"AI Agents May Always Fall for Prompt Injections","concept_definition","r/netsec - AI Agents May Always Fall for Prompt Injections","https://www.reddit.com/r/netsec/comments/1u0wykc/ai_agents_may_always_fall_for_prompt_injections/","Frames prompt injection as a persistent agent security issue."
"It seems fundamental to the architecture of LLMs but it should be specified as LLMs and not AI.","concept_definition","r/netsec - AI Agents May Always Fall for Prompt Injections","https://www.reddit.com/r/netsec/comments/1u0wykc/ai_agents_may_always_fall_for_prompt_injections/","Explains the distinction between LLM-specific vulnerability and broader AI."
"Social engineering is prompt injection for people.","low_signal_or_general","r/netsec - AI Agents May Always Fall for Prompt Injections","https://www.reddit.com/r/netsec/comments/1u0wykc/ai_agents_may_always_fall_for_prompt_injections/","Analogy is memorable but too broad to teach a concrete AI security control or tactic."
"This is not new information. Even Sam Altman has acknowledged this.","low_signal_or_general","r/netsec - AI Agents May Always Fall for Prompt Injections","https://www.reddit.com/r/netsec/comments/1u0wykc/ai_agents_may_always_fall_for_prompt_injections/","Dismissive commentary with limited technical detail."
"Augustus: Open Source LLM Prompt Injection Tool","tool_or_control","r/netsec - Augustus open source LLM prompt injection tool","https://www.reddit.com/r/netsec/comments/1r0h42m/augustus_open_source_llm_prompt_injection_tool/","Names Augustus as an LLM prompt-injection testing tool."
"The distinction matters because prompt injection defense at the model layer will never be 100%.","concept_definition","r/netsec - Augustus open source LLM prompt injection tool","https://www.reddit.com/r/netsec/comments/1r0h42m/augustus_open_source_llm_prompt_injection_tool/","Explains why model-layer defense alone is insufficient."
"The real question is: what happens when it fails?","concept_definition","r/netsec - Augustus open source LLM prompt injection tool","https://www.reddit.com/r/netsec/comments/1r0h42m/augustus_open_source_llm_prompt_injection_tool/","Frames failure handling as the core security concern."
"If the injected instruction executes with the agent's full permissions, you have a governance problem, not just a prompt injection problem.","concept_definition","r/netsec - Augustus open source LLM prompt injection tool","https://www.reddit.com/r/netsec/comments/1r0h42m/augustus_open_source_llm_prompt_injection_tool/","Defines prompt injection as an authority and governance problem."
"Augustus is an open-source LLM vulnerability scanner with 210+ adversarial probes.","tool_or_control","r/netsec - Augustus open source LLM prompt injection tool","https://www.reddit.com/r/netsec/comments/1r0h42m/augustus_open_source_llm_prompt_injection_tool/","Identifies a scanner and adversarial-probe testing capability."
"Fast LLM Prompt Injection Detection with No Extra Latency","tool_or_control","r/cybersecurity - Fast LLM Prompt Injection Detection","https://www.reddit.com/r/cybersecurity/comments/1mmj60a/fast_llm_prompt_injection_detection_with_no_extra/","Names a detection approach for prompt injection."
"Since then I have seen prompt injection exploited in real-world bug bounty reports and research.","concept_definition","r/cybersecurity - Fast LLM Prompt Injection Detection","https://www.reddit.com/r/cybersecurity/comments/1mmj60a/fast_llm_prompt_injection_detection_with_no_extra/","Connects prompt injection to real-world security research and bug bounty findings."
"The attack can trick an LLM into ignoring prior instructions.","attack_or_testing_tactic","r/cybersecurity - Fast LLM Prompt Injection Detection","https://www.reddit.com/r/cybersecurity/comments/1mmj60a/fast_llm_prompt_injection_detection_with_no_extra/","Describes instruction override as an attack behavior."
"The attack can trick an LLM into revealing hidden system prompts.","attack_or_testing_tactic","r/cybersecurity - Fast LLM Prompt Injection Detection","https://www.reddit.com/r/cybersecurity/comments/1mmj60a/fast_llm_prompt_injection_detection_with_no_extra/","Describes system-prompt leakage as an attack outcome."
"The attack can trick an LLM into disabling safety guardrails.","attack_or_testing_tactic","r/cybersecurity - Fast LLM Prompt Injection Detection","https://www.reddit.com/r/cybersecurity/comments/1mmj60a/fast_llm_prompt_injection_detection_with_no_extra/","Describes guardrail bypass as an attack outcome."
"Scan malicious prompt injection using a local non-tool-calling model","tool_or_control","r/LocalLLaMA - Scan malicious prompt injection using a local model","https://www.reddit.com/r/LocalLLaMA/comments/1ryu75z/scan_malicious_prompt_injection_using_a_local/","Describes a local model used as a scanning control."
"Claude Code supports the ! operator to execute bash commands directly and that can be included in skills.","attack_or_testing_tactic","r/LocalLLaMA - Scan malicious prompt injection using a local model","https://www.reddit.com/r/LocalLLaMA/comments/1ryu75z/scan_malicious_prompt_injection_using_a_local/","Describes command-execution capability that increases prompt-injection impact."
"Prompt injection explained, with video, slides, and a transcript","concept_definition","r/netsec - Prompt injection explained","https://www.reddit.com/r/netsec/comments/13h7n2w/prompt_injection_explained_with_video_slides_and/","Post title identifies a conceptual explanation of prompt injection."
"We're just concatenating into the prompt and passing it into the black box that is the LLM.","concept_definition","r/netsec - Prompt injection explained","https://www.reddit.com/r/netsec/comments/13h7n2w/prompt_injection_explained_with_video_slides_and/","Explains prompt construction as concatenation into a black-box model."
"Prompt Injection AI hacking and LLM Attacks","low_signal_or_general","r/cybersecurity - Prompt Injection AI hacking and LLM Attacks","https://www.reddit.com/r/cybersecurity/","High-level title-style statement without a specific technical method in the excerpt."
"Demonstration: prompt-injection failures in a simulated help-desk LLM","attack_or_testing_tactic","r/netsec - Help-desk LLM prompt-injection failures","https://www.reddit.com/r/netsec/comments/1qdovq3/demonstration_promptinjection_failures_in_a/","Describes testing prompt-injection failures in a simulated support deployment."
"I built this as a small demonstration to explore prompt-injection and instruction-override failure modes in help-desk-style LLM deployments.","attack_or_testing_tactic","r/netsec - Help-desk LLM prompt-injection failures","https://www.reddit.com/r/netsec/comments/1qdovq3/demonstration_promptinjection_failures_in_a/","Describes a test scenario for instruction override in help-desk LLMs."
